{
  "brand": {
    "name": "Unnamed Indie Scent Studio",
    "tone": "minimal literary",
    "price_positioning": "premium indie",
    "forbidden_words": ["soul", "destiny", "eternity", "healing"]
  },
  "fragrance": {
    "top_notes": ["bergamot"],
    "middle_notes": ["fig", "iris"],
    "base_notes": ["musk", "cedarwood"],
    "accords": ["green musk", "wet concrete", "white shirt"],
    "intensity": 2,
    "longevity": 3
  },
  "scene": {
    "location": "Seongsu cafe street",
    "weather": "after rain",
    "time_of_day": "late afternoon",
    "season": "spring",
    "situation": "walking alone before meeting someone",
    "target_impression": "clean, calm, slightly distant but soft",
    "emotions": ["calm", "distance", "quiet confidence"]
  },
  "output_type": "popup_result",
  "irrationality_level": 0.18
}
